{
  "schemaVersion": 1,
  "compatibilityVersion": "4.21.10",
  "seed": 42,
  "turn": 0,
  "instructionsApplied": [
    "new_game",
    "select_first_unit",
    "noop"
  ],
  "metadata": {
    "rulesets": 2,
    "civilizations": [
      "Greece",
      "Rome"
    ],
    "tileCount": 331,
    "unitCount": 4,
    "selectedUnit": "Settler@-4,-6",
    "tiles": [
      "-10,-10:Ocean:",
      "-10,-9:Ocean:",
      "-10,-8:Ocean:",
      "-10,-7:Ocean:",
      "-10,-6:Ocean:",
      "-10,-5:Ocean:",
      "-10,-4:Ocean:",
      "-10,-3:Ocean:",
      "-10,-2:Ocean:",
      "-10,-1:Ocean:",
      "-10,0:Ocean:",
      "-9,-10:Ocean:",
      "-9,-9:Ocean:",
      "-9,-8:Ocean:",
      "-9,-7:Coast:",
      "-9,-6:Coast:",
      "-9,-5:Coast:",
      "-9,-4:Ocean:",
      "-9,-3:Ocean:",
      "-9,-2:Ocean:",
      "-9,-1:Ocean:",
      "-9,0:Ocean:",
      "-9,1:Ocean:",
      "-8,-10:Coast:",
      "-8,-9:Coast:",
      "-8,-8:Coast:",
      "-8,-7:Coast:",
      "-8,-6:Coast:",
      "-8,-5:Tundra:",
      "-8,-4:Coast:",
      "-8,-3:Coast:",
      "-8,-2:Coast:",
      "-8,-1:Ocean:",
      "-8,0:Coast:Atoll",
      "-8,1:Ocean:",
      "-8,2:Ocean:",
      "-7,-10:Coast:",
      "-7,-9:Coast:",
      "-7,-8:Tundra:",
      "-7,-7:Plains:",
      "-7,-6:Tundra:",
      "-7,-5:Tundra:",
      "-7,-4:Plains:",
      "-7,-3:Coast:",
      "-7,-2:Plains:",
      "-7,-1:Coast:",
      "-7,0:Coast:",
      "-7,1:Ocean:",
      "-7,2:Ocean:",
      "-7,3:Ocean:",
      "-6,-10:Coast:",
      "-6,-9:Snow:Hill",
      "-6,-8:Snow:Hill",
      "-6,-7:Plains:Hill",
      "-6,-6:Grassland:",
      "-6,-5:Grassland:",
      "-6,-4:Plains:Forest",
      "-6,-3:Plains:",
      "-6,-2:Desert:Hill",
      "-6,-1:Desert:Hill",
      "-6,0:Plains:Forest+Hill",
      "-6,1:Coast:",
      "-6,2:Ocean:",
      "-6,3:Ocean:",
      "-6,4:Ocean:",
      "-5,-10:Coast:",
      "-5,-9:Snow:Hill",
      "-5,-8:Tundra:",
      "-5,-7:Tundra:Hill",
      "-5,-6:Grassland:",
      "-5,-5:Grassland:",
      "-5,-4:Grassland:Forest",
      "-5,-3:Desert:",
      "-5,-2:Desert:",
      "-5,-1:Grassland:",
      "-5,0:Grassland:Forest",
      "-5,1:Grassland:Hill",
      "-5,2:Coast:",
      "-5,3:Coast:",
      "-5,4:Ocean:",
      "-5,5:Ocean:",
      "-4,-10:Coast:",
      "-4,-9:Snow:Hill",
      "-4,-8:Tundra:Hill",
      "-4,-7:Plains:",
      "-4,-6:Plains:",
      "-4,-5:Grassland:",
      "-4,-4:Grassland:Hill",
      "-4,-3:Desert:",
      "-4,-2:Grassland:Hill",
      "-4,-1:Grassland:Hill",
      "-4,0:Grassland:Jungle",
      "-4,1:Grassland:Hill",
      "-4,2:Plains:",
      "-4,3:Coast:",
      "-4,4:Ocean:",
      "-4,5:Ocean:",
      "-4,6:Ocean:",
      "-3,-10:Coast:",
      "-3,-9:Coast:",
      "-3,-8:Tundra:",
      "-3,-7:Plains:Hill",
      "-3,-6:Plains:",
      "-3,-5:Grassland:",
      "-3,-4:Plains:Hill",
      "-3,-3:Plains:Hill",
      "-3,-2:Plains:",
      "-3,-1:Grassland:Hill",
      "-3,0:Plains:Forest",
      "-3,1:Plains:Forest+Hill",
      "-3,2:Plains:",
      "-3,3:Coast:",
      "-3,4:Coast:",
      "-3,5:Ocean:",
      "-3,6:Ocean:",
      "-3,7:Ocean:",
      "-2,-10:Coast:",
      "-2,-9:Coast:",
      "-2,-8:Grassland:Marsh",
      "-2,-7:Grassland:Hill",
      "-2,-6:Grassland:",
      "-2,-5:Desert:Hill",
      "-2,-4:Plains:",
      "-2,-3:Plains:",
      "-2,-2:Plains:Hill",
      "-2,-1:Mountain:",
      "-2,0:Plains:Hill",
      "-2,1:Plains:Forest",
      "-2,2:Plains:Hill",
      "-2,3:Coast:",
      "-2,4:Coast:",
      "-2,5:Ocean:",
      "-2,6:Ocean:",
      "-2,7:Ocean:",
      "-2,8:Ocean:",
      "-1,-10:Ocean:",
      "-1,-9:Ocean:",
      "-1,-8:Coast:",
      "-1,-7:Coast:",
      "-1,-6:Plains:Hill",
      "-1,-5:Grassland:Hill",
      "-1,-4:Grassland:",
      "-1,-3:Grassland:",
      "-1,-2:Grassland:Hill",
      "-1,-1:Plains:Hill",
      "-1,0:Plains:Hill",
      "-1,1:Grassland:",
      "-1,2:Plains:",
      "-1,3:Coast:",
      "-1,4:Ocean:",
      "-1,5:Ocean:",
      "-1,6:Ocean:",
      "-1,7:Ocean:",
      "-1,8:Ocean:",
      "-1,9:Ocean:",
      "0,-10:Ocean:",
      "0,-9:Ocean:",
      "0,-8:Ocean:",
      "0,-7:Coast:",
      "0,-6:Plains:Forest+Hill",
      "0,-5:Plains:Hill",
      "0,-4:Grassland:",
      "0,-3:Plains:",
      "0,-2:Plains:",
      "0,-1:Plains:Hill",
      "0,0:Grassland:",
      "0,1:Plains:",
      "0,2:Plains:",
      "0,3:Coast:",
      "0,4:Ocean:",
      "0,5:Ocean:",
      "0,6:Ocean:",
      "0,7:Ocean:",
      "0,8:Ocean:",
      "0,9:Ocean:",
      "0,10:Ocean:",
      "1,-9:Ocean:",
      "1,-8:Ocean:",
      "1,-7:Coast:",
      "1,-6:Coast:",
      "1,-5:Grassland:",
      "1,-4:Plains:",
      "1,-3:Plains:Jungle",
      "1,-2:Plains:",
      "1,-1:Grassland:",
      "1,0:Plains:",
      "1,1:Plains:Forest",
      "1,2:Plains:",
      "1,3:Grassland:",
      "1,4:Coast:",
      "1,5:Coast:",
      "1,6:Ocean:",
      "1,7:Ocean:",
      "1,8:Ocean:",
      "1,9:Ocean:",
      "1,10:Ocean:",
      "2,-8:Ocean:",
      "2,-7:Ocean:",
      "2,-6:Ocean:",
      "2,-5:Coast:",
      "2,-4:Coast:",
      "2,-3:Grassland:Forest",
      "2,-2:Grassland:Forest",
      "2,-1:Grassland:",
      "2,0:Plains:",
      "2,1:Grassland:",
      "2,2:Grassland:Forest",
      "2,3:Grassland:Jungle",
      "2,4:Grassland:Jungle",
      "2,5:Coast:",
      "2,6:Ocean:",
      "2,7:Ocean:",
      "2,8:Ocean:",
      "2,9:Ocean:",
      "2,10:Ocean:",
      "3,-7:Ocean:",
      "3,-6:Ocean:",
      "3,-5:Coast:",
      "3,-4:Coast:",
      "3,-3:Coast:",
      "3,-2:Coast:",
      "3,-1:Plains:",
      "3,0:Plains:",
      "3,1:Grassland:Forest",
      "3,2:Plains:",
      "3,3:Plains:",
      "3,4:Desert:",
      "3,5:Coast:",
      "3,6:Coast:",
      "3,7:Coast:",
      "3,8:Coast:",
      "3,9:Ocean:",
      "3,10:Ocean:",
      "4,-6:Ocean:",
      "4,-5:Ocean:",
      "4,-4:Ocean:",
      "4,-3:Ocean:",
      "4,-2:Coast:",
      "4,-1:Coast:",
      "4,0:Coast:",
      "4,1:Grassland:",
      "4,2:Plains:",
      "4,3:Desert:",
      "4,4:Grassland:Hill",
      "4,5:Plains:Jungle",
      "4,6:Coast:",
      "4,7:Grassland:",
      "4,8:Coast:",
      "4,9:Coast:",
      "4,10:Ocean:",
      "5,-5:Ocean:",
      "5,-4:Ocean:",
      "5,-3:Ocean:",
      "5,-2:Ocean:",
      "5,-1:Ocean:",
      "5,0:Coast:",
      "5,1:Coast:",
      "5,2:Coast:",
      "5,3:Grassland:",
      "5,4:Grassland:",
      "5,5:Plains:",
      "5,6:Plains:Jungle",
      "5,7:Grassland:",
      "5,8:Coast:",
      "5,9:Ocean:",
      "5,10:Ocean:",
      "6,-4:Ocean:",
      "6,-3:Ocean:",
      "6,-2:Ocean:",
      "6,-1:Ocean:",
      "6,0:Ocean:",
      "6,1:Coast:",
      "6,2:Coast:",
      "6,3:Coast:",
      "6,4:Coast:",
      "6,5:Plains:",
      "6,6:Coast:",
      "6,7:Tundra:",
      "6,8:Coast:",
      "6,9:Coast:",
      "6,10:Ocean:",
      "7,-3:Ocean:",
      "7,-2:Ocean:",
      "7,-1:Ocean:",
      "7,0:Ocean:",
      "7,1:Ocean:",
      "7,2:Ocean:",
      "7,3:Coast:",
      "7,4:Ocean:",
      "7,5:Coast:Atoll",
      "7,6:Coast:",
      "7,7:Coast:",
      "7,8:Coast:",
      "7,9:Ocean:",
      "7,10:Ocean:",
      "8,-2:Ocean:",
      "8,-1:Ocean:",
      "8,0:Ocean:",
      "8,1:Ocean:",
      "8,2:Ocean:",
      "8,3:Ocean:",
      "8,4:Ocean:",
      "8,5:Coast:",
      "8,6:Ocean:",
      "8,7:Coast:",
      "8,8:Coast:",
      "8,9:Ocean:",
      "8,10:Ocean:",
      "9,-1:Ocean:",
      "9,0:Ocean:",
      "9,1:Ocean:",
      "9,2:Ocean:",
      "9,3:Ocean:",
      "9,4:Ocean:",
      "9,5:Ocean:",
      "9,6:Ocean:",
      "9,7:Ocean:",
      "9,8:Ocean:",
      "9,9:Ocean:",
      "9,10:Ocean:",
      "10,0:Ocean:",
      "10,1:Ocean:",
      "10,2:Ocean:",
      "10,3:Ocean:",
      "10,4:Ocean:",
      "10,5:Ocean:",
      "10,6:Ocean:",
      "10,7:Ocean:",
      "10,8:Ocean:",
      "10,9:Ocean:",
      "10,10:Ocean:"
    ],
    "units": [
      "Greece:Settler@3,4",
      "Greece:Warrior@3,4",
      "Rome:Settler@-4,-6",
      "Rome:Warrior@-4,-6"
    ]
  }
}
